{"review_id":"2026-05-12-1513-pytorch-trainer","started_at":"2026-05-12T15:13:43+00:00","project_profile":{"type":"ml-pipeline","languages":["python","yaml"],"frameworks":["pytorch","numpy"],"datastores":[]},"review_scope":{"kind":"full","description":"full project — all 5 source files","files":["src/train.py","src/model.py","src/data.py","tests/test_train.py","configs/default.yaml"]},"aims_snapshot_path":".review/aims.md","casting":{"stage_1":[{"persona":"peer-python-reviewer","files":["src/train.py","src/model.py","src/data.py","tests/test_train.py"]},{"persona":"peer-quality-engineer","files":["src/train.py","src/model.py","src/data.py","tests/test_train.py"]},{"persona":"peer-readability-engineer","files":["src/train.py","src/model.py","src/data.py","tests/test_train.py","configs/default.yaml"]}],"stage_2":[{"persona":"team-security-reviewer","files":["src/train.py","src/data.py","configs/default.yaml"]},{"persona":"team-data-ml-reviewer","files":["src/train.py","src/model.py","src/data.py"]},{"persona":"team-performance-reviewer","files":["src/train.py","src/model.py","src/data.py","tests/test_train.py"]}],"stage_3":[{"persona":"lead-senior-architect","files":"all"},{"persona":"lead-project-manager","files":"all"}]},"casting_reasoning":"Python-only ML pipeline with PyTorch and numpy; full-project scope across 5 source files. Stage 1 casts peer-python-reviewer (all .py files), peer-quality-engineer (test coverage against the reproducibility and split-integrity success criteria), and peer-readability-engineer (full scope exceeds 200-line threshold). Stage 2 casts team-data-ml-reviewer as the primary lens — the stated aims (reproducibility, data leakage, metric logging) are squarely in its domain. team-performance-reviewer is cast because scope exceeds 5 files and the user has an explicit 30-minute wall-clock constraint. team-security-reviewer casts by default on config loading and file path handling. Stage 3 leadership casts unconditionally."}
