{"review_id":"2026-05-21-0235-pytorch-trainer-full","started_at":"2026-05-21T02:35:41Z","project_profile":{"type":"ml-pipeline","languages":["python","yaml"],"frameworks":["pytorch"],"datastores":[]},"review_scope":{"kind":"full","description":"full project review of pytorch trainer fixture","files":["src/data.py","src/model.py","src/train.py","tests/test_train.py","configs/default.yaml","pyproject.toml"]},"aims_snapshot_path":".review/aims.md","casting":{"stage_1":[{"persona":"peer-python-reviewer","files":["src/data.py","src/model.py","src/train.py","tests/test_train.py"]},{"persona":"peer-quality-engineer","files":["tests/test_train.py","src/data.py","src/model.py","src/train.py"]},{"persona":"peer-readability-engineer","files":["src/data.py","src/model.py","src/train.py","tests/test_train.py"]}],"stage_2":[{"persona":"team-security-reviewer","files":["src/data.py","src/model.py","src/train.py","configs/default.yaml","pyproject.toml"]},{"persona":"team-data-ml-reviewer","files":["src/data.py","src/model.py","src/train.py","tests/test_train.py","configs/default.yaml"]},{"persona":"team-performance-reviewer","files":["src/data.py","src/model.py","src/train.py","configs/default.yaml"]}],"stage_3":[{"persona":"lead-senior-architect","files":"all"},{"persona":"lead-project-manager","files":"all"}]},"casting_reasoning":"Pure PyTorch ML pipeline with no web surface, no database, and no external API integration. Stage 1 casts peer-python-reviewer for the four .py source files, peer-quality-engineer because the test suite covers only a narrow happy path and production training code warrants scrutiny, and peer-readability-engineer because the full source set exceeds 200 lines and the user's success criterion emphasized clarity and maintainability. Stage 2 casts team-data-ml-reviewer as the primary domain lens (torch imports in all three src files, training loop, custom dataset class), team-performance-reviewer because training throughput and GPU utilisation are the defining success criterion for a trainer, and team-security-reviewer by default policy on file I/O paths, config loading from YAML, and checkpoint persistence. Frontend, backend, network, database, devops, accessibility, observability, and privacy personas are all skipped: no server, no UI, no migrations, no PII, no CI config in scope. Stage 3 leadership casts as required."}
